{
  "$schema": "https://json-schema.org/draft/2020-12/schema",
  "title": "Invoice",
  "type": "object",
  "additionalProperties": false,
  "required": ["invoice_number", "issue_date", "currency", "supplier", "line_items", "subtotal", "tax_amount", "total"],
  "properties": {
    "invoice_number": {"type": "string", "minLength": 1, "pattern": "\\S"},
    "issue_date": {"type": "string", "format": "date"},
    "due_date": {"type": "string", "format": "date"},
    "currency": {"type": "string", "pattern": "^[A-Z]{3}$"},
    "supplier": {"$ref": "#/$defs/party"},
    "customer": {"$ref": "#/$defs/party"},
    "line_items": {
      "type": "array",
      "minItems": 1,
      "items": {
        "type": "object",
        "additionalProperties": false,
        "required": ["description", "quantity", "unit_price", "amount"],
        "properties": {
          "description": {"type": "string", "minLength": 1, "pattern": "\\S"},
          "quantity": {"type": "number", "exclusiveMinimum": 0},
          "unit_price": {"type": "number", "minimum": 0},
          "amount": {"type": "number", "minimum": 0}
        }
      }
    },
    "subtotal": {"type": "number", "minimum": 0},
    "tax_amount": {"type": "number", "minimum": 0},
    "total": {"type": "number", "minimum": 0}
  },
  "$defs": {
    "party": {
      "type": "object",
      "additionalProperties": false,
      "required": ["name"],
      "properties": {"name": {"type": "string", "minLength": 1, "pattern": "\\S"}}
    }
  }
}
